{
  "version": 1,
  "updatedAt": "2026-10-26T18:37:33.927Z",
  "league": {
    "name": "دوري الغارقه",
    "nameEn": "sunken league",
    "season": "2026/2027",
    "logo": "",
    "country": "YE",
    "settings": {
      "winPoints": 3,
      "drawPoints": 1,
      "lossPoints": 0,
      "yellowForSuspension": 3,
      "redCardBan": 2,
      "resetCardsAfterRounds": 0,
      "tiebreakers": [
        "points",
        "h2h",
        "h2hDiff",
        "h2hGoals",
        "diff",
        "goals",
        "wins",
        "fairplay",
        "draw"
      ],
      "pointsDeduction": [
        {
          "id": "pd1",
          "teamId": "t11",
          "amount": 3,
          "reason": "مخالفة لوائح التسجيل",
          "reasonEn": "Registration breach",
          "date": "2026-10-15T19:48:00"
        }
      ],
      "qualificationSpots": {
        "champions": 4,
        "europa": 2,
        "relegation": 3
      }
    }
  },
  "teams": [
    {
      "id": "t1",
      "name": "النسور الذهبية",
      "nameEn": "Golden Eagles",
      "shortName": "النسور",
      "shortNameEn": "EAG",
      "logo": "",
      "founded": 1957,
      "stadium": "ملعب الثورة",
      "stadiumEn": "Al-Thawra Stadium",
      "city": "صنعاء",
      "colors": {
        "primary": "#0B4EA2",
        "secondary": "#FFFFFF"
      },
      "coach": "أحمد الحربي",
      "group": "A"
    },
    {
      "id": "t2",
      "name": "الصقور الحمراء",
      "nameEn": "Red Falcons",
      "shortName": "الصقور",
      "shortNameEn": "FAL",
      "logo": "",
      "founded": 1962,
      "stadium": "ملعب 22 مايو",
      "stadiumEn": "22 May Stadium",
      "city": "عدن",
      "colors": {
        "primary": "#C8102E",
        "secondary": "#FFD700"
      },
      "coach": "خالد العمري",
      "group": "A"
    },
    {
      "id": "t3",
      "name": "الأمواج الزرقاء",
      "nameEn": "Blue Waves",
      "shortName": "الأمواج",
      "shortNameEn": "WAV",
      "logo": "",
      "founded": 1970,
      "stadium": "ملعب العلفي",
      "stadiumEn": "Al-Olofi Stadium",
      "city": "الحديدة",
      "colors": {
        "primary": "#0077B6",
        "secondary": "#90E0EF"
      },
      "coach": "سامي النجار",
      "group": "A"
    },
    {
      "id": "t4",
      "name": "الفرسان",
      "nameEn": "Knights FC",
      "shortName": "الفرسان",
      "shortNameEn": "KNI",
      "logo": "",
      "founded": 1965,
      "stadium": "ملعب الشهداء",
      "stadiumEn": "Martyrs Stadium",
      "city": "تعز",
      "colors": {
        "primary": "#1B1B1B",
        "secondary": "#D4AF37"
      },
      "coach": "منصور القاضي",
      "group": "A"
    },
    {
      "id": "t5",
      "name": "الأخضر الملكي",
      "nameEn": "Royal Greens",
      "shortName": "الأخضر",
      "shortNameEn": "ROY",
      "logo": "",
      "founded": 1975,
      "stadium": "ملعب الكبسي",
      "stadiumEn": "Al-Kibsi Stadium",
      "city": "إب",
      "colors": {
        "primary": "#0B6E4F",
        "secondary": "#F1FAEE"
      },
      "coach": "ياسر الشامي",
      "group": "A"
    },
    {
      "id": "t6",
      "name": "نجوم الشرق",
      "nameEn": "Eastern Stars",
      "shortName": "النجوم",
      "shortNameEn": "STA",
      "logo": "",
      "founded": 1980,
      "stadium": "ملعب بارادم",
      "stadiumEn": "Baradem Stadium",
      "city": "المكلا",
      "colors": {
        "primary": "#6A0DAD",
        "secondary": "#F4F4F4"
      },
      "coach": "فهد باوزير",
      "group": "A"
    },
    {
      "id": "t7",
      "name": "الشعلة",
      "nameEn": "Al-Shoula",
      "shortName": "الشعلة",
      "shortNameEn": "SHO",
      "logo": "",
      "founded": 1968,
      "stadium": "ملعب الحبيشي",
      "stadiumEn": "Al-Habishi Stadium",
      "city": "عدن",
      "colors": {
        "primary": "#F77F00",
        "secondary": "#003049"
      },
      "coach": "رامي الصبري",
      "group": "B"
    },
    {
      "id": "t8",
      "name": "الوحدة",
      "nameEn": "Al-Wahda",
      "shortName": "الوحدة",
      "shortNameEn": "WAH",
      "logo": "",
      "founded": 1990,
      "stadium": "ملعب الظرافي",
      "stadiumEn": "Al-Dhorafi Stadium",
      "city": "صنعاء",
      "colors": {
        "primary": "#2A9D8F",
        "secondary": "#FFFFFF"
      },
      "coach": "عادل المقطري",
      "group": "B"
    },
    {
      "id": "t9",
      "name": "التلال",
      "nameEn": "Al-Tilal",
      "shortName": "التلال",
      "shortNameEn": "TIL",
      "logo": "",
      "founded": 1905,
      "stadium": "ملعب التلال",
      "stadiumEn": "Al-Tilal Ground",
      "city": "عدن",
      "colors": {
        "primary": "#9B2226",
        "secondary": "#E9D8A6"
      },
      "coach": "نبيل الحامد",
      "group": "B"
    },
    {
      "id": "t10",
      "name": "الأهلي",
      "nameEn": "Al-Ahli",
      "shortName": "الأهلي",
      "shortNameEn": "AHL",
      "logo": "",
      "founded": 1952,
      "stadium": "ملعب الأهلي",
      "stadiumEn": "Al-Ahli Ground",
      "city": "صنعاء",
      "colors": {
        "primary": "#D62828",
        "secondary": "#FFFFFF"
      },
      "coach": "مراد الوصابي",
      "group": "B"
    },
    {
      "id": "t11",
      "name": "شباب الجبل",
      "nameEn": "Mountain Youth",
      "shortName": "الجبل",
      "shortNameEn": "MTN",
      "logo": "",
      "founded": 1984,
      "stadium": "ملعب ذمار",
      "stadiumEn": "Dhamar Stadium",
      "city": "ذمار",
      "colors": {
        "primary": "#3A5A40",
        "secondary": "#DAD7CD"
      },
      "coach": "وليد الحداد",
      "group": "B"
    },
    {
      "id": "t12",
      "name": "الهلال الساحلي",
      "nameEn": "Coastal Hilal",
      "shortName": "الهلال",
      "shortNameEn": "HIL",
      "logo": "",
      "founded": 1971,
      "stadium": "ملعب الساحل",
      "stadiumEn": "Coastal Arena",
      "city": "الحديدة",
      "colors": {
        "primary": "#023E8A",
        "secondary": "#ADE8F4"
      },
      "coach": "جمال السقاف",
      "group": "B"
    }
  ],
  "players": [
    {
      "id": "p1",
      "teamId": "t1",
      "name": "علي الأغبري",
      "nameEn": "Ali Al-Aghbari",
      "number": 1,
      "position": "GK",
      "birthdate": "2005-01-15",
      "nationality": "OM",
      "photo": "",
      "status": "active"
    },
    {
      "id": "p2",
      "teamId": "t1",
      "name": "عبدالله الجابري",
      "nameEn": "Abdullah Al-Jaberi",
      "number": 22,
      "position": "GK",
      "birthdate": "2003-04-15",
      "nationality": "YE",
      "photo": "",
      "status": "active"
    },
    {
      "id": "p3",
      "teamId": "t1",
      "name": "ماجد العولقي",
      "nameEn": "Majed Al-Awlaqi",
      "number": 2,
      "position": "DF",
      "birthdate": "2004-09-20",
      "nationality": "YE",
      "photo": "",
      "status": "active"
    },
    {
      "id": "p4",
      "teamId": "t1",
      "name": "مازن الجابري",
      "nameEn": "Mazen Al-Jaberi",
      "number": 3,
      "position": "DF",
      "birthdate": "1996-12-26",
      "nationality": "YE",
      "photo": "",
      "status": "active"
    },
    {
      "id": "p5",
      "teamId": "t1",
      "name": "رائد اليافعي",
      "nameEn": "Raed Al-Yafei",
      "number": 4,
      "position": "DF",
      "birthdate": "2000-05-07",
      "nationality": "OM",
      "photo": "",
      "status": "active"
    },
    {
      "id": "p6",
      "teamId": "t1",
      "name": "إبراهيم العبسي",
      "nameEn": "Ibrahim Al-Absi",
      "number": 5,
      "position": "DF",
      "birthdate": "1997-11-14",
      "nationality": "OM",
      "photo": "",
      "status": "active"
    },
    {
      "id": "p7",
      "teamId": "t1",
      "name": "رائد العبسي",
      "nameEn": "Raed Al-Absi",
      "number": 15,
      "position": "DF",
      "birthdate": "1992-12-15",
      "nationality": "YE",
      "photo": "",
      "status": "active"
    },
    {
      "id": "p8",
      "teamId": "t1",
      "name": "سيف العبسي",
      "nameEn": "Saif Al-Absi",
      "number": 23,
      "position": "DF",
      "birthdate": "1994-04-18",
      "nationality": "YE",
      "photo": "",
      "status": "active"
    },
    {
      "id": "p9",
      "teamId": "t1",
      "name": "طارق الزبيدي",
      "nameEn": "Tareq Al-Zubaidi",
      "number": 26,
      "position": "DF",
      "birthdate": "2001-01-28",
      "nationality": "SA",
      "photo": "",
      "status": "active"
    },
    {
      "id": "p10",
      "teamId": "t1",
      "name": "نادر المخلافي",
      "nameEn": "Nader Al-Mikhlafi",
      "number": 6,
      "position": "MF",
      "birthdate": "1998-02-20",
      "nationality": "IQ",
      "photo": "",
      "status": "active"
    },
    {
      "id": "p11",
      "teamId": "t1",
      "name": "خالد القحطاني",
      "nameEn": "Khaled Al-Qahtani",
      "number": 8,
      "position": "MF",
      "birthdate": "2005-08-09",
      "nationality": "YE",
      "photo": "",
      "status": "active"
    },
    {
      "id": "p12",
      "teamId": "t1",
      "name": "سالم السقطري",
      "nameEn": "Salem Al-Soqotri",
      "number": 10,
      "position": "MF",
      "birthdate": "1998-02-10",
      "nationality": "YE",
      "photo": "",
      "status": "injured"
    },
    {
      "id": "p13",
      "teamId": "t1",
      "name": "بلال البكري",
      "nameEn": "Bilal Al-Bakri",
      "number": 14,
      "position": "MF",
      "birthdate": "2004-09-17",
      "nationality": "YE",
      "photo": "",
      "status": "active"
    },
    {
      "id": "p14",
      "teamId": "t1",
      "name": "يوسف الصلوي",
      "nameEn": "Yousef Al-Salwi",
      "number": 16,
      "position": "MF",
      "birthdate": "2001-10-18",
      "nationality": "YE",
      "photo": "",
      "status": "active"
    },
    {
      "id": "p15",
      "teamId": "t1",
      "name": "يوسف الأغبري",
      "nameEn": "Yousef Al-Aghbari",
      "number": 18,
      "position": "MF",
      "birthdate": "1995-04-20",
      "nationality": "OM",
      "photo": "",
      "status": "active"
    },
    {